{
  "$schema": "https://json-schema.org/draft/2020-12/schema",
  "$id": "https://github.com/yagooyarzabaldev-ops/gemelo-digital-rosario/contracts/identity-verification.schema.json",
  "title": "Identity Verification Result",
  "description": "Consent-based self-service identity verification result consumed by the web 'personal digital twin' view. The subject verifies their OWN identity with explicit consent; the document is produced by an authorized provider (live) or a simulated provider (mock/demo). It is NOT a people-search/dossier format: there is no third-party lookup.",
  "type": "object",
  "required": [
    "contract",
    "contract_version",
    "request_id",
    "generated_at",
    "mode",
    "consent",
    "verification",
    "source_status",
    "governance"
  ],
  "properties": {
    "contract": { "const": "identity-verification" },
    "contract_version": { "type": "string", "pattern": "^\\d+\\.\\d+\\.\\d+$" },
    "request_id": { "type": "string", "minLength": 1 },
    "generated_at": { "$ref": "#/$defs/isoTimestamp" },
    "mode": {
      "enum": ["mock", "live"],
      "description": "mock = simulated provider + synthetic data; live = authorized official provider (e.g. RENAPER under convenio). The UI must display the mode prominently."
    },
    "disclaimer": {
      "type": "string",
      "description": "Required when mode is mock: human-readable statement that data is synthetic and the provider is simulated."
    },
    "demo_test_subject": {
      "type": "object",
      "description": "Only present in mock mode: the single synthetic identity the demo will verify. The demo refuses any other document, so it cannot be used against real people.",
      "required": ["documento_numero", "sexo"],
      "properties": {
        "documento_numero": { "type": "string" },
        "sexo": { "enum": ["F", "M", "X"] }
      }
    },
    "consent": {
      "type": "object",
      "required": ["granted", "subject_confirmed_owner", "purpose", "legal_basis", "terms_version", "consented_at"],
      "properties": {
        "granted": { "const": true, "description": "No verification may occur without consent; a non-granted state is represented by an error result, not by this document." },
        "subject_confirmed_owner": { "const": true, "description": "The subject affirmed they are the document holder." },
        "purpose": { "type": "string", "minLength": 1 },
        "legal_basis": { "type": "string", "minLength": 1 },
        "terms_version": { "type": "string", "minLength": 1 },
        "consented_at": { "$ref": "#/$defs/isoTimestamp" },
        "expires_at": { "oneOf": [{ "$ref": "#/$defs/isoTimestamp" }, { "type": "null" }] }
      }
    },
    "verification": {
      "type": "object",
      "required": ["status", "provider", "verified_at", "request_key", "error"],
      "properties": {
        "status": {
          "enum": ["verified", "not_found", "failed", "pending"],
          "description": "not_found = provider returned no match (a valid state); failed = provider/transport error; pending = awaiting provider."
        },
        "provider": { "type": "string", "minLength": 1 },
        "provider_label": { "type": "string" },
        "verified_at": { "oneOf": [{ "$ref": "#/$defs/isoTimestamp" }, { "type": "null" }] },
        "request_key": { "type": "string", "minLength": 1, "description": "Idempotency key; matches identity.verification_requests.request_key." },
        "match_score": { "type": ["number", "null"], "minimum": 0, "maximum": 1 },
        "error": { "type": ["string", "null"] }
      }
    },
    "subject": {
      "type": "object",
      "description": "The subject's own verified data. Present only when verification.status = verified. Data minimization applies: only fields needed for the stated purpose.",
      "required": ["documento", "sexo", "nombres", "apellidos"],
      "properties": {
        "documento": {
          "type": "object",
          "required": ["tipo", "numero"],
          "properties": {
            "tipo": { "enum": ["DNI"] },
            "numero": { "type": "string", "pattern": "^\\d{7,8}$" },
            "ejemplar": { "type": "string" }
          }
        },
        "sexo": { "enum": ["F", "M", "X"] },
        "nombres": { "type": "string", "minLength": 1 },
        "apellidos": { "type": "string", "minLength": 1 },
        "cuil": { "type": ["string", "null"] },
        "fecha_nacimiento": { "type": ["string", "null"], "pattern": "^\\d{4}-\\d{2}-\\d{2}$" },
        "nacionalidad": { "type": ["string", "null"] },
        "fallecido": { "type": "boolean" },
        "domicilio": {
          "type": ["object", "null"],
          "properties": {
            "calle": { "type": ["string", "null"] },
            "numero": { "type": ["string", "null"] },
            "piso": { "type": ["string", "null"] },
            "ciudad": { "type": ["string", "null"] },
            "provincia": { "type": ["string", "null"] },
            "codigo_postal": { "type": ["string", "null"] },
            "lon": { "type": ["number", "null"], "minimum": -180, "maximum": 180 },
            "lat": { "type": ["number", "null"], "minimum": -90, "maximum": 90 }
          }
        },
        "foto": {
          "type": ["object", "null"],
          "required": ["kind"],
          "properties": {
            "kind": {
              "enum": ["placeholder", "official"],
              "description": "placeholder = generated/synthetic image (mock mode). official = real document photo, only ever in authorized live mode."
            },
            "mime": { "type": "string" },
            "uri": { "type": "string" },
            "note": { "type": "string" }
          }
        }
      }
    },
    "source_status": {
      "type": "array",
      "minItems": 1,
      "items": {
        "type": "object",
        "required": ["source_id", "name", "status", "mode", "last_success_at", "last_error"],
        "properties": {
          "source_id": { "type": "string", "minLength": 1 },
          "name": { "type": "string", "minLength": 1 },
          "url": { "type": ["string", "null"] },
          "status": { "enum": ["ok", "stale", "error", "mock", "disabled"] },
          "mode": { "enum": ["mock", "live"] },
          "last_success_at": { "oneOf": [{ "$ref": "#/$defs/isoTimestamp" }, { "type": "null" }] },
          "last_error": { "type": ["string", "null"] },
          "note": { "type": "string" }
        }
      }
    },
    "governance": {
      "type": "object",
      "required": ["data_subject_rights", "rights_contact", "retention_until"],
      "properties": {
        "data_subject_rights": { "type": "string", "minLength": 1 },
        "rights_contact": { "type": "string", "minLength": 1 },
        "retention_until": { "oneOf": [{ "$ref": "#/$defs/isoTimestamp" }, { "type": "null" }] },
        "stored_fields_minimized": { "type": "boolean" }
      }
    },
    "enrichment": {
      "type": "object",
      "description": "Public-data enrichment of the subject's OWN profile, keyed by their own DNI/CUIL, included ONLY when the subject explicitly consented to it. Self-service only — never a third-party lookup. In mock mode every source is simulated/synthetic and makes no real query.",
      "required": ["consented", "sources"],
      "properties": {
        "consented": { "type": "boolean", "description": "True only if the subject consented to public-data enrichment." },
        "sources": {
          "type": "array",
          "items": {
            "type": "object",
            "required": ["source_id", "name", "category", "status", "mode", "last_success_at", "last_error", "records"],
            "properties": {
              "source_id": { "type": "string", "minLength": 1 },
              "name": { "type": "string", "minLength": 1 },
              "category": { "type": "string", "description": "e.g. fiscal, electoral, boletin_oficial, registro." },
              "url": { "type": ["string", "null"] },
              "status": {
                "enum": ["ok", "ok_empty", "stale", "error", "mock"],
                "description": "ok_empty = source answered and there is genuinely no record (a valid state, e.g. 'sin registros')."
              },
              "mode": { "enum": ["mock", "live"] },
              "last_success_at": { "oneOf": [{ "$ref": "#/$defs/isoTimestamp" }, { "type": "null" }] },
              "last_error": { "type": ["string", "null"] },
              "note": { "type": "string" },
              "records": {
                "type": "array",
                "description": "Public records found for the subject at this source. Empty when status is ok_empty.",
                "items": {
                  "type": "object",
                  "required": ["label", "value"],
                  "properties": {
                    "label": { "type": "string", "minLength": 1 },
                    "value": { "type": "string" },
                    "detail": { "type": "string" }
                  }
                }
              }
            }
          }
        }
      }
    }
  },
  "allOf": [
    {
      "if": { "properties": { "mode": { "const": "mock" } } },
      "then": { "required": ["disclaimer", "demo_test_subject"] }
    },
    {
      "if": { "properties": { "verification": { "properties": { "status": { "const": "verified" } } } } },
      "then": { "required": ["subject"] }
    }
  ],
  "$defs": {
    "isoTimestamp": {
      "type": "string",
      "pattern": "^\\d{4}-\\d{2}-\\d{2}T\\d{2}:\\d{2}:\\d{2}(\\.\\d+)?Z$"
    }
  }
}
